disease_name,question,answer,source_url
Primary health care,Is primary health care only for low-resource settings?,"No. Primary health care is an approach to health system strengthening that can work effectively in both high and low-resource settings. While it makes health services more accessible to communities, it also strengthens the referral system between primary care facilities and secondary or tertiary care, including hospitals.
No. Primary health care is an approach to health system strengthening that can work effectively in both high and low-resource settings. While it makes health services more accessible to communities, it also strengthens the referral system between primary care facilities and secondary or tertiary care, including hospitals.",https://www.who.int/news-room/questions-and-answers/item/primary-health-care
Primary health care,Is primary health care only about basic services?,"Primary health care provides essential care that can cover the majority of people’s health needs throughout their lives. Because primary health care focuses on the person rather than the disease, it is an approach that moves away from overspecialization. Its goal is to work through multidisciplinary teams with strong referral systems to secondary and tertiary care when needed.
Primary health care provides essential care that can cover the majority of people’s health needs throughout their lives. Because primary health care focuses on the person rather than the disease, it is an approach that moves away from overspecialization. Its goal is to work through multidisciplinary teams with strong referral systems to secondary and tertiary care when needed.",https://www.who.int/news-room/questions-and-answers/item/primary-health-care
Primary health care,Is primary health care only about maternal and child health?,"Primary health care is about health at all ages. It involves prevention, health promotion, treatment, rehabilitation and palliation. This approach empowers people and communities to choose healthier lifestyles, prevent diseases, access early detection, treatment and recovery services.
Primary health care is about health at all ages. It involves prevention, health promotion, treatment, rehabilitation and palliation. This approach empowers people and communities to choose healthier lifestyles, prevent diseases, access early detection, treatment and recovery services.",https://www.who.int/news-room/questions-and-answers/item/primary-health-care
Rehabilitation,What is rehabilitation?,"Rehabilitation is a health service for people who experience a decline in their functioning due to an illness, injury, surgery, disability or age. Its primary goal is to help regain, maintain or improve functioning so the person can lead an independent and fulfilling live.
Rehabilitation is a health service for people who experience a decline in their functioning due to an illness, injury, surgery, disability or age. Its primary goal is to help regain, maintain or improve functioning so the person can lead an independent and fulfilling live.",https://www.who.int/news-room/questions-and-answers/item/rehabilitation
Rehabilitation,Who might benefit from rehabilitation?,"Children, adolescents, adults or older people may need rehabilitation at some point in their lives. This includes people with acute or chronic health conditions (such as stroke, heart disease, respiratory diseases, cancer), injuries (such as fractures, burns, brain injuries) or congenital disorders (such as autism spectrum disorders, cerebral palsy).
Children, adolescents, adults or older people may need rehabilitation at some point in their lives. This includes people with acute or chronic health conditions (such as stroke, heart disease, respiratory diseases, cancer), injuries (such as fractures, burns, brain injuries) or congenital disorders (such as autism spectrum disorders, cerebral palsy).",https://www.who.int/news-room/questions-and-answers/item/rehabilitation
Rehabilitation,Is rehabilitation about drug and alcohol addiction?,"Rehabilitation services may benefit people with many health conditions. Drug and alcohol rehabilitation is only one type of rehabilitation that is aimed at helping people overcome addiction to substances. Learn more: WHO Alcohol, Drugs and Addictive Behaviours unit .
Rehabilitation services may benefit people with many health conditions. Drug and alcohol rehabilitation is only one type of rehabilitation that is aimed at helping people overcome addiction to substances.
Learn more: WHO Alcohol, Drugs and Addictive Behaviours unit .",https://www.who.int/news-room/questions-and-answers/item/rehabilitation
Rehabilitation,How many people could benefit from rehabilitation?,"Globally, 1 in 3 people are currently living with a health condition that may benefit from rehabilitation. This need is growing as the population ages with more chronic diseases. Over 50% of people in some low- and middle-income countries lack access to needed rehabilitation services. Emergencies like conflicts and disasters increase demand while disrupting services, worsening the unmet need for rehabilitation worldwide.
Globally, 1 in 3 people are currently living with a health condition that may benefit from rehabilitation. This need is growing as the population ages with more chronic diseases.
Over 50% of people in some low- and middle-income countries lack access to needed rehabilitation services. Emergencies like conflicts and disasters increase demand while disrupting services, worsening the unmet need for rehabilitation worldwide.",https://www.who.int/news-room/questions-and-answers/item/rehabilitation
Rehabilitation,What are the most frequent health conditions that could benefit from rehabilitation?,"There are many different conditions that can benefit from rehabilitation such us: musculoskeletal conditions neurological conditions cardiopulmonary conditions vision impairment and hearing loss neurodevelopmental disorders mental health conditions cancers.
There are many different conditions that can benefit from rehabilitation such us:",https://www.who.int/news-room/questions-and-answers/item/rehabilitation
Rehabilitation,What are examples of rehabilitation?,"Some examples of rehabilitation include: speech and language training to improve a person’s communication after a brain injury; physical exercise training to improve muscle strength, voluntary movements and balance in people with stroke or Parkinson disease; modifying an older person’s home environment to improve their safety and independence at home and to reduce their risk of falls; educating a person with heart disease on how to exercise safely; preparing a person with an amputation to be able to use a prosthetic device; making, fitting and refitting the prosthesis; positioning and splinting techniques to assist with skin healing, techniques and exercises to reduce swelling, and to regain movement after burn injury; prescribing medicine to reduce spasticity for a child with cerebral palsy; psychological therapies for a person with emotional distress following a spinal cord injury; social skills training for persons with schizophrenia, autism spectrum disorders or disorders of intellectual disability; training a person with vision loss in the use of a white cane; and working with a patient in intensive care to improve their breathing, prevent complications and speed their recovery after critical illness.
Some examples of rehabilitation include:",https://www.who.int/news-room/questions-and-answers/item/rehabilitation
Rehabilitation,What would my rehabilitation look like?,"Your rehabilitation programme will depend on your specific situation. As a general rule, a rehabilitation professional will assess your level of functioning and potential underlaying causes for your problems in functioning. Based on this assessment, the rehabilitation professional will define the goals of your rehabilitation programme together with you. Next, the type of intervention, intensity and duration that best adapt to your situation will be designed. You may need exercises or training, assistive products, modifications to your environment, education and advice, or use of certain medicines. Throughout the process the rehabilitation professional would evaluate whether your goals are being achieved.
Your rehabilitation programme will depend on your specific situation. As a general rule, a rehabilitation professional will assess your level of functioning and potential underlaying causes for your problems in functioning. Based on this assessment, the rehabilitation professional will define the goals of your rehabilitation programme together with you. Next, the type of intervention, intensity and duration that best adapt to your situation will be designed. You may need exercises or training, assistive products, modifications to your environment, education and advice, or use of certain medicines. Throughout the process the rehabilitation professional would evaluate whether your goals are being achieved.",https://www.who.int/news-room/questions-and-answers/item/rehabilitation
Rehabilitation,Where does rehabilitation take place?,"There is no one single setting for a rehabilitation service. However, rehabilitation professionals should be in a range of available health and non-health settings. This includes in hospitals, in specialist rehabilitation centres, in health clinics and posts, in schools and at people’s homes.
There is no one single setting for a rehabilitation service. However, rehabilitation professionals should be in a range of available health and non-health settings. This includes in hospitals, in specialist rehabilitation centres, in health clinics and posts, in schools and at people’s homes.",https://www.who.int/news-room/questions-and-answers/item/rehabilitation
Rehabilitation,Who can provide rehabilitation?,"Depending on the rehabilitation need, one or more health professionals may collaborate to provide comprehensive care. The most common rehabilitation professionals include physiotherapists, occupational therapists, speech and language therapists, audiologists, orthotists and prosthetists, clinical psychologists, physical medicine and rehabilitation doctors, and rehabilitation nurses. However, many more exist, and the professionals can vary between countries.
Depending on the rehabilitation need, one or more health professionals may collaborate to provide comprehensive care.
The most common rehabilitation professionals include physiotherapists, occupational therapists, speech and language therapists, audiologists, orthotists and prosthetists, clinical psychologists, physical medicine and rehabilitation doctors, and rehabilitation nurses. However, many more exist, and the professionals can vary between countries.",https://www.who.int/news-room/questions-and-answers/item/rehabilitation
Rehabilitation,Are there any risks to receiving rehabilitation?,"As for any health service, safety considerations are needed. The rehabilitation professional will make sure that the type and intensity of the selected interventions do no harm but are save.
As for any health service, safety considerations are needed. The rehabilitation professional will make sure that the type and intensity of the selected interventions do no harm but are save.",https://www.who.int/news-room/questions-and-answers/item/rehabilitation
Rehabilitation,How long will I need rehabilitation and what will be the results?,"Usually, a rehabilitation programme comprises a series of sessions, but the number of sessions will depend on your needs. In the ideal situation, you will regain full functioning but often, depending on the severity of your health condition, the level of functioning will be optimized so that you will be able to return to your meaningful activities with e.g. the use of assistive products in a modified environment.
Usually, a rehabilitation programme comprises a series of sessions, but the number of sessions will depend on your needs. In the ideal situation, you will regain full functioning but often, depending on the severity of your health condition, the level of functioning will be optimized so that you will be able to return to your meaningful activities with e.g. the use of assistive products in a modified environment.",https://www.who.int/news-room/questions-and-answers/item/rehabilitation
Social determinants of health,What are the determinants of health?,"The determinants of health include: the social and economic environment, the physical environment, and the person’s individual characteristics and behaviours. The context of people’s lives determine their health, and so blaming individuals for having poor health or crediting them for good health is inappropriate. Individuals are unlikely to be able to directly control many of the determinants of health. These determinants—or things that make people healthy or not—include the above factors, and many others: Income and social status - higher income and social status are linked to better health. The greater the gap between the richest and poorest people, the greater the differences in health. Education – low education levels are linked with poor health, more stress and lower self-confidence. Physical environment – safe water and clean air, healthy workplaces, safe houses, communities and roads all contribute to good health. Employment and working conditions – people in employment are healthier, particularly those who have more control over their working conditions Social support networks – greater support from families, friends and communities is linked to better health. Culture - customs and traditions, and the beliefs of the family and community all affect health. Genetics - inheritance plays a part in determining lifespan, healthiness and the likelihood of developing certain illnesses. Personal behaviour and coping skills – balanced eating, keeping active, smoking, drinking, and how we deal with life’s stresses and challenges all affect health. Health services - access and use of services that prevent and treat disease influences health Gender - Men and women suffer from different types of diseases at different ages.
The determinants of health include:
The context of people’s lives determine their health, and so blaming individuals for having poor health or crediting them for good health is inappropriate. Individuals are unlikely to be able to directly control many of the determinants of health. These determinants—or things that make people healthy or not—include the above factors, and many others:",https://www.who.int/news-room/questions-and-answers/item/determinants-of-health
Social determinants of health,How does evidence-based approach work within health impact assessment?,"An evidence base about the impact that projects, programmes and policies have had on health is required to carry out health impact assessment (HIA). The best available evidence is used within the appraisal stage of HIA to determine what impacts may occur (both positive and negative), the size of the impact (if possible) and the distribution of that impact in different population groups. It is generally assumed that the evidence for health impacts exists, and that searching and collating will provide the necessary evidence. Unfortunately this is not often the case, and the evidence of health impacts is often not available. This is because of the long causal pathway between the implementation of a project/programme/policy and any potential impact on population health, and the many confounding factors that make the determination of a link difficult. Within the HIA it is important therefore to be explicit about sources of evidence and to identify missing or incomplete information. Providing a comprehensive review of the evidence base is not simple. It needs to draw on the best available evidence – that from reviews and research papers, and including qualitative and quantitative evidence. This information must be supplemented with local and expert knowledge, policy information, and proposal specific information. However, there are examples where the best available evidence has been documented, and in some cases summarised. These are presented below: Transport Food and Agriculture Housing Waste Energy Industry Urbanization Water Radiation Nutrition and health
An evidence base about the impact that projects, programmes and policies have had on health is required to carry out health impact assessment (HIA). The best available evidence is used within the appraisal stage of HIA to determine what impacts may occur (both positive and negative), the size of the impact (if possible) and the distribution of that impact in different population groups. It is generally assumed that the evidence for health impacts exists, and that searching and collating will provide the necessary evidence. Unfortunately this is not often the case, and the evidence of health impacts is often not available. This is because of the long causal pathway between the implementation of a project/programme/policy and any potential impact on population health, and the many confounding factors that make the determination of a link difficult. Within the HIA it is important therefore to be explicit about sources of evidence and to identify missing or incomplete information.
Providing a comprehensive review of the evidence base is not simple. It needs to draw on the best available evidence – that from reviews and research papers, and including qualitative and quantitative evidence. This information must be supplemented with local and expert knowledge, policy information, and proposal specific information.
However, there are examples where the best available evidence has been documented, and in some cases summarised. These are presented below:",https://www.who.int/news-room/questions-and-answers/item/determinants-of-health
Suicide,How many people die by suicide every year?,"Suicide is a global public health problem. Every year more than 720 000 people die as a result of suicide. The majority of these deaths (73%) occur in low- and middle-income countries. Beyond this, suicide has a ripple effect that impacts on societies, communities, friends and families who have lost a loved one to suicide.
Suicide is a global public health problem. Every year more than 720 000 people die as a result of suicide. The majority of these deaths (73%) occur in low- and middle-income countries. Beyond this, suicide has a ripple effect that impacts on societies, communities, friends and families who have lost a loved one to suicide.",https://www.who.int/news-room/questions-and-answers/item/suicide
Suicide,How many people attempt suicide every year?,"There are indications that for each person who dies of suicide there are likely to be more than 20 others who attempt suicide. This ratio differs widely by country, region, sex, age and method.",https://www.who.int/news-room/questions-and-answers/item/suicide
Suicide,Are suicides preventable?,"Access to emotional support at the right time and restricting access to highly lethal means of suicide to buy time while dealing with suicidal feelings can prevent suicide. Effective interventions exist. WHO’s LIVE LIFE approach recommends four key interventions which have proven to be effective: limit access to the means of suicide (e.g., restrictions on toxic pesticides and      firearms); interact with the media for responsible reporting of suicide; foster socio-emotional life skills in adolescents; and early identification, assessment, management and follow up of anyone who is      affected by suicidal behaviours. The foundational pillars of the interventions for suicide prevention are situation analysis, multisectoral collaboration, awareness raising, capacity building, financing, surveillance, monitoring and evaluation.
Access to emotional support at the right time and restricting access to highly lethal means of suicide to buy time while dealing with suicidal feelings can prevent suicide. Effective interventions exist. WHO’s LIVE LIFE approach recommends four key interventions which have proven to be effective:
The foundational pillars of the interventions for suicide prevention are situation analysis, multisectoral collaboration, awareness raising, capacity building, financing, surveillance, monitoring and evaluation.",https://www.who.int/news-room/questions-and-answers/item/suicide
Suicide,Does talking about suicide lead to someone taking their own life?,"Talking openly about suicide can give a person other options or the time to rethink his/her decision, thereby preventing suicide.
Talking openly about suicide can give a person other options or the time to rethink his/her decision, thereby preventing suicide.",https://www.who.int/news-room/questions-and-answers/item/suicide
Suicide,"If someone is feeling suicidal, are they determined to end their own life?","Studies suggest that people who are suicidal are often ambivalent about living or dying and they look for relief from their pain. Someone may act impulsively and die a few days later, even though they would have liked to live on. Access to emotional support at the right time may prevent suicide. Studies with individuals who have made near-fatal suicide attempts indicate that many of them are pleased later on that they survived.
Studies suggest that people who are suicidal are often ambivalent about living or dying and they look for relief from their pain. Someone may act impulsively and die a few days later, even though they would have liked to live on. Access to emotional support at the right time may prevent suicide. Studies with individuals who have made near-fatal suicide attempts indicate that many of them are pleased later on that they survived.",https://www.who.int/news-room/questions-and-answers/item/suicide
Suicide,Is it true that only people with mental health conditions are suicidal?,"Many people who are suicidal do not have a mental health condition, and many people with mental health conditions do not have a wish to die. In suicidal crisis situations, many underlying and contributing factors need to be considered – such as acute emotional distress, chronic pain, experience of violence and social determinants.
Many people who are suicidal do not have a mental health condition, and many people with mental health conditions do not have a wish to die. In suicidal crisis situations, many underlying and contributing factors need to be considered – such as acute emotional distress, chronic pain, experience of violence and social determinants.",https://www.who.int/news-room/questions-and-answers/item/suicide
Suicide,What causes people to be suicidal?,"Suicidal behaviours are not easy to explain. They are never the result of a single factor or event. The factors that lead individuals to take their own life are multiple and complex. Health, mental health, stressful life events, and social and cultural factors need to be considered when trying to understand suicidal behaviour.
Suicidal behaviours are not easy to explain. They are never the result of a single factor or event. The factors that lead individuals to take their own life are multiple and complex. Health, mental health, stressful life events, and social and cultural factors need to be considered when trying to understand suicidal behaviour.",https://www.who.int/news-room/questions-and-answers/item/suicide
Suicide,Do you know someone who may be considering suicide?,"Do you know someone who may be considering suicide? It's not uncommon to think about taking your own life. If you're worried about someone, read on... What you should know It's 0K to talk about suicide. Asking someone if they are thinking about suicide does not make them act on their feelings. In fact, it often reduces anxiety and helps people feel understood. Warning signs Severe mood changes. Social withdrawal. Expressing thoughts, feelings or plans about ending their life. Saying things like ""No-one will miss me when I'm gone"" or ""I've got no reason to live."" Looking for ways to kill themselves. Saying goodbye to close family members and friends. Giving away valued possessions. Who is at risk? People who have tried to take their own life before. People in acute emotional distress or with depression. Someone who's socially isolated. Someone with alcohol or drug problems. People living with chronic pain or illness. People who have experienced violence, abuse or other trauma. People from groups of society that are marginalized or discriminated against. What you can do Find an appropriate time and a quiet place to talk with the person you are worried about. Let them know that you are there to listen. Encourage them to seek help from a health worker, such as a doctor or mental health professional, or a counsellor or social worker. And offer to accompany them to an appointment. If you think someone is in immediate danger, don't leave them alone. Contact the emergency services, a crisis line, a health worker or a family member. If the person you're worried about lives with you, make sure they don't have access to means of self-harm at home. Check in regularly to see how they're doing. Share this as an infographic
Do you know someone who may be considering suicide?
It's not uncommon to think about taking your own life. If you're worried about someone, read on...
What you should know
Warning signs
Who is at risk?
What you can do
Share this as an infographic",https://www.who.int/news-room/questions-and-answers/item/suicide
