disease_name,question,answer,source_url
HIV and AIDS,What other kinds of care do people living with HIV need?,"While ART helps the immune system stay strong, people living with HIV can benefit from counselling and psychosocial support to ensure that they are truly “living well” with HIV. HIV is manageable, but it is a life-long chronic illness, and people may need support with their mental health and with lifestyle changes to support good health through life. Access to good nutrition, safe water and basic hygiene can also help people living with HIV to maintain a good quality of life. As with the general community, people living with HIV may experience a broad range of other health conditions that may need treatment and care. A people-centred approach to health care, particularly through primary health services, aims to deliver comprehensive health services to people living with HIV, in which all their health issues are addressed.
While ART helps the immune system stay strong, people living with HIV can benefit from counselling and psychosocial support to ensure that they are truly “living well” with HIV. HIV is manageable, but it is a life-long chronic illness, and people may need support with their mental health and with lifestyle changes to support good health through life. Access to good nutrition, safe water and basic hygiene can also help people living with HIV to maintain a good quality of life. As with the general community, people living with HIV may experience a broad range of other health conditions that may need treatment and care. A people-centred approach to health care, particularly through primary health services, aims to deliver comprehensive health services to people living with HIV, in which all their health issues are addressed.",https://www.who.int/news-room/questions-and-answers/item/HIV-AIDS
HIV and AIDS,What is the intersection between HIV and monkeypox  ?,"People living with HIV may be at risk of developing monkeypox (mpox) because of weak immune systems. There is some evidence that being immunocompromised may increase your risk of becoming infected if you are exposed, and of having serious illness or dying from mpox. However, more data is needed to understand this fully. Many people with mpox in the current outbreak are also living with HIV, but there have been relatively few severe cases of mpox, likely because in most cases their HIV infection was well-controlled. Since the beginning of the outbreak, a high prevalence of HIV infection (52%; 14 573/28 006) has been reported among cases with known HIV status. Monkeypox and HIV share common behavioural risk factors such as transmission through sexual contact. Consideration should be given to testing any person with monkeypox infection for HIV infection if their status is not already known. People with multiple sexual partners, including people who are living with HIV, are encouraged to take steps to reduce their risk of being exposed to mpox by avoiding close contact with anyone who has symptoms and by avoiding high-risk situations where multiple contacts may occur even with persons who may not realize they have mpox. Reducing the number of sexual partners may reduce your risk.
People living with HIV may be at risk of developing monkeypox (mpox) because of weak immune systems. There is some evidence that being immunocompromised may increase your risk of becoming infected if you are exposed, and of having serious illness or dying from mpox. However, more data is needed to understand this fully.
Many people with mpox in the current outbreak are also living with HIV, but there have been relatively few severe cases of mpox, likely because in most cases their HIV infection was well-controlled. Since the beginning of the outbreak, a high prevalence of HIV infection (52%; 14 573/28 006) has been reported among cases with known HIV status. Monkeypox and HIV share common behavioural risk factors such as transmission through sexual contact. Consideration should be given to testing any person with monkeypox infection for HIV infection if their status is not already known.
People with multiple sexual partners, including people who are living with HIV, are encouraged to take steps to reduce their risk of being exposed to mpox by avoiding close contact with anyone who has symptoms and by avoiding high-risk situations where multiple contacts may occur even with persons who may not realize they have mpox. Reducing the number of sexual partners may reduce your risk.",https://www.who.int/news-room/questions-and-answers/item/HIV-AIDS
Healthy diet,What is a healthy diet for breastfeed babies and young children?,"From birth to 6 months of age, feed babies exclusively with breast milk (i.e. give them no other food or drink) and feed them on demand (i.e. as often as they want, day and night). At 6 months of age, introduce a variety of safe and nutritious foods to complement breastfeeding, and continue to breastfeed until babies are 2 years of age or beyond. Do not add salt or sugars to foods for babies and young children.
From birth to 6 months of age, feed babies exclusively with breast milk (i.e. give them no other food or drink) and feed them on demand (i.e. as often as they want, day and night).
At 6 months of age, introduce a variety of safe and nutritious foods to complement breastfeeding, and continue to breastfeed until babies are 2 years of age or beyond.
Do not add salt or sugars to foods for babies and young children.",https://www.who.int/news-room/questions-and-answers/item/healthy-diet-keys-to-eating-well
Healthy diet,Why should babies be breastfed exclusively?,"On its own, breast milk provides all the nutrients and fluids that babies need for their first 6 months of healthy growth and development. Exclusively breastfed babies have better resistance against common childhood illnesses such as diarrhoea, respiratory infections and ear infections. In later life, those who were breastfed as infants are less likely to become overweight or obese, or to suffer from noncommunicable diseases, such as diabetes, heart disease and stroke.
On its own, breast milk provides all the nutrients and fluids that babies need for their first 6 months of healthy growth and development. Exclusively breastfed babies have better resistance against common childhood illnesses such as diarrhoea, respiratory infections and ear infections. In later life, those who were breastfed as infants are less likely to become overweight or obese, or to suffer from noncommunicable diseases, such as diabetes, heart disease and stroke.",https://www.who.int/news-room/questions-and-answers/item/healthy-diet-keys-to-eating-well
Healthy diet,Why is it important to eat a variety of foods?,"Eating a variety of whole (i.e. unprocessed) and fresh foods every day helps children and adults to obtain the right amounts of essential nutrients. It also helps them to avoid a diet that is high in sugars, fats and salt, which can lead to unhealthy weight gain (i.e. overweight and obesity) and noncommunicable diseases. Eating a healthy, balanced diet is especially important for young children's development. It also helps older people to have healthier and more active lives. WHO recommends that people eat a combination of different foods, including staple foods (e.g. cereals such as wheat, barley, rye, maize or rice, or starchy tubers or roots such as potato, yam, taro or cassava), legumes (e.g. lentils, beans), vegetables, fruit and foods from animals sources (e.g. meat, fish, eggs and milk).
Eating a variety of whole (i.e. unprocessed) and fresh foods every day helps children and adults to obtain the right amounts of essential nutrients. It also helps them to avoid a diet that is high in sugars, fats and salt, which can lead to unhealthy weight gain (i.e. overweight and obesity) and noncommunicable diseases. Eating a healthy, balanced diet is especially important for young children's development. It also helps older people to have healthier and more active lives.
WHO recommends that people eat a combination of different foods, including staple foods (e.g. cereals such as wheat, barley, rye, maize or rice, or starchy tubers or roots such as potato, yam, taro or cassava), legumes (e.g. lentils, beans), vegetables, fruit and foods from animals sources (e.g. meat, fish, eggs and milk).",https://www.who.int/news-room/questions-and-answers/item/healthy-diet-keys-to-eating-well
Healthy diet,What are the benefits of eating plenty of vegetables and fruit?,"WHO recommends that people eat a wide variety of vegetables and fruit. For snacks, choose raw vegetables and fresh fruit, rather than foods that are high in sugars, fats or salt. Avoid overcooking vegetables and fruit as this can lead to the loss of important vitamins. When using canned or dried vegetables and fruit, choose varieties without added salt and sugars Vegetables and fruit are important sources of vitamins, minerals, dietary fibre, plant protein and antioxidants. People whose diets are rich in vegetables and fruit have a significantly lower risk of obesity, heart disease, stroke, diabetes and certain types of cancer.
WHO recommends that people eat a wide variety of vegetables and fruit. For snacks, choose raw vegetables and fresh fruit, rather than foods that are high in sugars, fats or salt.
Avoid overcooking vegetables and fruit as this can lead to the loss of important vitamins. When using canned or dried vegetables and fruit, choose varieties without added salt and sugars
Vegetables and fruit are important sources of vitamins, minerals, dietary fibre, plant protein and antioxidants. People whose diets are rich in vegetables and fruit have a significantly lower risk of obesity, heart disease, stroke, diabetes and certain types of cancer.",https://www.who.int/news-room/questions-and-answers/item/healthy-diet-keys-to-eating-well
Healthy diet,Is it healthy to eat moderate amounts of fats and oils?,"Moderate amounts of fats and oils are part of a healthy diet. Fats and oils are concentrated sources of energy, and eating too much fat, particularly the wrong kinds of fat, can be harmful to health. For example, people who eat too much saturated fat and trans-fat are at higher risk of heart disease and stroke. Trans-fat may occur naturally in certain meat and milk products, but the industrially produced trans-fat (e.g. partially hydrogenated oils) present in various processed foods is the main source. Use unsaturated vegetable oils (e.g. olive, soy, sunflower or corn oil) rather than animals fats or oils high in saturated fats (e.g. butter, ghee, lard, coconut and palm oil). When possible, choose white meat (e.g. poultry) and fish, which are generally low in fats, rather than red meat. Eat only limited amounts of processed meats because these are high in fat and salt. Try also to opt for low-fat or reduced fat versions of milk and dairy products. Avoid processed, baked and fried foods that contain industrially produced trans-fat.
Moderate amounts of fats and oils are part of a healthy diet. Fats and oils are concentrated sources of energy, and eating too much fat, particularly the wrong kinds of fat, can be harmful to health. For example, people who eat too much saturated fat and trans-fat are at higher risk of heart disease and stroke. Trans-fat may occur naturally in certain meat and milk products, but the industrially produced trans-fat (e.g. partially hydrogenated oils) present in various processed foods is the main source.
Use unsaturated vegetable oils (e.g. olive, soy, sunflower or corn oil) rather than animals fats or oils high in saturated fats (e.g. butter, ghee, lard, coconut and palm oil).
When possible, choose white meat (e.g. poultry) and fish, which are generally low in fats, rather than red meat. Eat only limited amounts of processed meats because these are high in fat and salt. Try also to opt for low-fat or reduced fat versions of milk and dairy products. Avoid processed, baked and fried foods that contain industrially produced trans-fat.",https://www.who.int/news-room/questions-and-answers/item/healthy-diet-keys-to-eating-well
Healthy diet,How can I reduce my intake of salt and sugar?,"People whose diets are high in sodium (including salt) have a greater risk of high blood pressure, which can increase their risk of heart disease and stroke. Similarly, those whose diets are high in sugars have a greater risk of becoming overweight or obese, and an increased risk of tooth decay. People who reduce the amount of sugars in their diet may also reduce their risk of noncommunicable diseases such as heart disease and stroke. When cooking and preparing foods, limit the amount of salt and high-sodium condiments (e.g. soy sauce and fish sauce). Also, try to avoid foods like snacks that are high in salt and sugars. Limit intake of soft drinks or soda and other drinks that are high in sugars (e.g. fruit juices, cordials and syrups, flavoured milks and yogourt drinks), and choose fresh fruits instead of sweet snacks such as cookies, cakes and chocolate.
People whose diets are high in sodium (including salt) have a greater risk of high blood pressure, which can increase their risk of heart disease and stroke. Similarly, those whose diets are high in sugars have a greater risk of becoming overweight or obese, and an increased risk of tooth decay. People who reduce the amount of sugars in their diet may also reduce their risk of noncommunicable diseases such as heart disease and stroke. When cooking and preparing foods, limit the amount of salt and high-sodium condiments (e.g. soy sauce and fish sauce). Also, try to avoid foods like snacks that are high in salt and sugars. Limit intake of soft drinks or soda and other drinks that are high in sugars (e.g. fruit juices, cordials and syrups, flavoured milks and yogourt drinks), and choose fresh fruits instead of sweet snacks such as cookies, cakes and chocolate.
People whose diets are high in sodium (including salt) have a greater risk of high blood pressure, which can increase their risk of heart disease and stroke. Similarly, those whose diets are high in sugars have a greater risk of becoming overweight or obese, and an increased risk of tooth decay. People who reduce the amount of sugars in their diet may also reduce their risk of noncommunicable diseases such as heart disease and stroke.
When cooking and preparing foods, limit the amount of salt and high-sodium condiments (e.g. soy sauce and fish sauce). Also, try to avoid foods like snacks that are high in salt and sugars. Limit intake of soft drinks or soda and other drinks that are high in sugars (e.g. fruit juices, cordials and syrups, flavoured milks and yogourt drinks), and choose fresh fruits instead of sweet snacks such as cookies, cakes and chocolate.",https://www.who.int/news-room/questions-and-answers/item/healthy-diet-keys-to-eating-well
Hepatitis B,What is hepatitis?,"Hepatitis is an inflammation of the liver. The condition can be self-limiting or can progress to fibrosis (scarring), cirrhosis or liver cancer. Hepatitis viruses are the most common cause of hepatitis in the world but other infections, toxic substances (e.g. alcohol, certain drugs), and autoimmune diseases can also cause hepatitis. There are 5 main hepatitis viruses, referred to as types A, B, C, D and E. These 5 types are of greatest concern because of the burden of illness and death they cause and the potential for outbreaks and epidemic spread. In particular, types B and C lead to chronic disease in hundreds of millions of people and, together, are the most common cause of liver cirrhosis and cancer. Hepatitis A and E are typically caused by ingestion of contaminated food or water. Hepatitis B, C and D usually occur as a result of parenteral contact with infected body fluids. Common modes of transmission for these viruses include receipt of contaminated blood or blood products, invasive medical procedures using contaminated equipment and for hepatitis B transmission from mother to baby at birth, from family member to child, and also by sexual contact. Acute infection may occur with limited or no symptoms, or may include symptoms such as jaundice (yellowing of the skin and eyes), dark urine, extreme fatigue, nausea, vomiting and abdominal pain.
Hepatitis is an inflammation of the liver. The condition can be self-limiting or can progress to fibrosis (scarring), cirrhosis or liver cancer. Hepatitis viruses are the most common cause of hepatitis in the world but other infections, toxic substances (e.g. alcohol, certain drugs), and autoimmune diseases can also cause hepatitis.
There are 5 main hepatitis viruses, referred to as types A, B, C, D and E. These 5 types are of greatest concern because of the burden of illness and death they cause and the potential for outbreaks and epidemic spread. In particular, types B and C lead to chronic disease in hundreds of millions of people and, together, are the most common cause of liver cirrhosis and cancer.
Hepatitis A and E are typically caused by ingestion of contaminated food or water. Hepatitis B, C and D usually occur as a result of parenteral contact with infected body fluids. Common modes of transmission for these viruses include receipt of contaminated blood or blood products, invasive medical procedures using contaminated equipment and for hepatitis B transmission from mother to baby at birth, from family member to child, and also by sexual contact.
Acute infection may occur with limited or no symptoms, or may include symptoms such as jaundice (yellowing of the skin and eyes), dark urine, extreme fatigue, nausea, vomiting and abdominal pain.",https://www.who.int/news-room/questions-and-answers/item/hepatitis
Hepatitis B,What are the different hepatitis viruses?,"Scientists have identified 5 unique hepatitis viruses, identified by the letters A, B, C, D, and E. While all cause liver disease, they vary in important ways. Hepatitis A virus (HAV) is present in the faeces of infected persons and is most often transmitted through consumption of contaminated water or food. Certain sex practices can also spread HAV. Infections are in many cases mild, with most people making a full recovery and remaining immune from further HAV infections. However, HAV infections can also be severe and life threatening. Most people in areas of the world with poor sanitation have been infected with this virus. Safe and effective vaccines are available to prevent HAV. Hepatitis B virus (HBV) is transmitted through exposure to infective blood, semen, and other body fluids. HBV can be transmitted from infected mothers to infants at the time of birth or from family member to infant in early childhood. Transmission may also occur through transfusions of HBV-contaminated blood and blood products, contaminated injections during medical procedures, and through injection drug use. HBV also poses a risk to healthcare workers who sustain accidental needle stick injuries while caring for infected-HBV patients. Safe and effective vaccines are available to prevent HBV. Hepatitis C virus (HCV) is mostly transmitted through exposure to infective blood. This may happen through transfusions of HCV-contaminated blood and blood products, contaminated injections during medical procedures, and through injection drug use. Sexual transmission is also possible, but is much less common. There is no vaccine for HCV. Hepatitis D virus (HDV) infections occur only in those who are infected with HBV. The dual infection of HDV and HBV can result in a more serious disease and worse outcome. Hepatitis B vaccines provide protection from HDV infection. Hepatitis E virus (HEV) is mostly transmitted through consumption of contaminated water or food. HEV is a common cause of hepatitis outbreaks in developing parts of the world and is increasingly recognized as an important cause of disease in developed countries. Safe and effective vaccines to prevent HEV infection have been developed but are not widely available.
Scientists have identified 5 unique hepatitis viruses, identified by the letters A, B, C, D, and E. While all cause liver disease, they vary in important ways.
Hepatitis A virus (HAV) is present in the faeces of infected persons and is most often transmitted through consumption of contaminated water or food. Certain sex practices can also spread HAV. Infections are in many cases mild, with most people making a full recovery and remaining immune from further HAV infections. However, HAV infections can also be severe and life threatening. Most people in areas of the world with poor sanitation have been infected with this virus. Safe and effective vaccines are available to prevent HAV.
Hepatitis B virus (HBV) is transmitted through exposure to infective blood, semen, and other body fluids. HBV can be transmitted from infected mothers to infants at the time of birth or from family member to infant in early childhood. Transmission may also occur through transfusions of HBV-contaminated blood and blood products, contaminated injections during medical procedures, and through injection drug use. HBV also poses a risk to healthcare workers who sustain accidental needle stick injuries while caring for infected-HBV patients. Safe and effective vaccines are available to prevent HBV.
Hepatitis C virus (HCV) is mostly transmitted through exposure to infective blood. This may happen through transfusions of HCV-contaminated blood and blood products, contaminated injections during medical procedures, and through injection drug use. Sexual transmission is also possible, but is much less common. There is no vaccine for HCV.
Hepatitis D virus (HDV) infections occur only in those who are infected with HBV. The dual infection of HDV and HBV can result in a more serious disease and worse outcome. Hepatitis B vaccines provide protection from HDV infection.
Hepatitis E virus (HEV) is mostly transmitted through consumption of contaminated water or food. HEV is a common cause of hepatitis outbreaks in developing parts of the world and is increasingly recognized as an important cause of disease in developed countries. Safe and effective vaccines to prevent HEV infection have been developed but are not widely available.",https://www.who.int/news-room/questions-and-answers/item/hepatitis
Leishmaniasis,What is leishmaniasis?,"Leishmaniasis is a disease caused by any species of Leishmania parasite. It is transmitted by the bite of an infected female sandfly. In most cases, a person who is infected by the parasite has neither symptoms nor signs of infection and is not considered to have leishmaniasis. Although there are some 20 different parasites that cause the disease, there are only three different types of leishmaniasis. The most common type (CL) causes skin lesions, mainly nodules or painless ulcers. The second type (VL, also known as kala-azar) is a life-threatening disease that causes anaemia (deficiency in the number or quality of red blood cells), fever, enlarged liver, enlarged spleen and significant weight loss. VL is invariably fatal if left untreated. The third type (MCL, or mucosal leishmaniasis alone) destroys the mucous membranes of the nose, mouth and throat cavities and surrounding tissues.
Leishmaniasis is a disease caused by any species of Leishmania parasite. It is transmitted by the bite of an infected female sandfly. In most cases, a person who is infected by the parasite has neither symptoms nor signs of infection and is not considered to have leishmaniasis. Although there are some 20 different parasites that cause the disease, there are only three different types of leishmaniasis.
The most common type (CL) causes skin lesions, mainly nodules or painless ulcers. The second type (VL, also known as kala-azar) is a life-threatening disease that causes anaemia (deficiency in the number or quality of red blood cells), fever, enlarged liver, enlarged spleen and significant weight loss. VL is invariably fatal if left untreated. The third type (MCL, or mucosal leishmaniasis alone) destroys the mucous membranes of the nose, mouth and throat cavities and surrounding tissues.",https://www.who.int/news-room/questions-and-answers/item/leishmaniasis
