disease_name,question,answer,source_url
Mpox,How can I protect myself and others against mpox?,"To protect yourself and others against mpox, know the signs and symptoms, how the virus spreads, what to do if you get ill, and the risk in your area or community. If the virus is spreading in your area or in your community, have open conversations with those you come into close contact with about any symptoms you or they may have. Avoid close contact with anyone who has mpox, including sexual contact. Clean your hands frequently with soap and water or an alcohol-based hand rub. If you think you might have mpox, you can act to protect others by seeking medical advice and isolating from others until you have been evaluated and tested. If you have mpox, you should isolate yourself from others until all your lesions have crusted over, the scabs have fallen off and a new layer of skin has formed underneath. This will stop you from passing on the virus to others. Follow your local health authority instructions on isolation at home or in a health facility. If having sex, use condoms as a precaution for 12 weeks (about 3 months) after you have recovered. In countries where some animals have been found to carry the monkeypox virus (i.e. some countries in in east, central and west Africa), protect yourself by avoiding unprotected contact with wild animals, especially those that are sick or dead (including their meat and blood). Any food containing animal parts or meat should be cooked thoroughly before eating.
To protect yourself and others against mpox, know the signs and symptoms, how the virus spreads, what to do if you get ill, and the risk in your area or community.
If the virus is spreading in your area or in your community, have open conversations with those you come into close contact with about any symptoms you or they may have. Avoid close contact with anyone who has mpox, including sexual contact. Clean your hands frequently with soap and water or an alcohol-based hand rub.
If you think you might have mpox, you can act to protect others by seeking medical advice and isolating from others until you have been evaluated and tested. If you have mpox, you should isolate yourself from others until all your lesions have crusted over, the scabs have fallen off and a new layer of skin has formed underneath. This will stop you from passing on the virus to others. Follow your local health authority instructions on isolation at home or in a health facility. If having sex, use condoms as a precaution for 12 weeks (about 3 months) after you have recovered.
In countries where some animals have been found to carry the monkeypox virus (i.e. some countries in in east, central and west Africa), protect yourself by avoiding unprotected contact with wild animals, especially those that are sick or dead (including their meat and blood). Any food containing animal parts or meat should be cooked thoroughly before eating.",https://www.who.int/news-room/questions-and-answers/item/mpox
Mpox,I am travelling to an mpox-affected area. What precautions should I take?,"Before travelling, equip yourself with information about mpox, including its signs and symptoms, how it spreads, the behaviours that increase your risk of infection, and how to seek medical care at your destination. Be aware that the country you’re visiting, as well as your own, may have specific entry requirements; inform yourself about them. Your healthcare provider will be able to discuss vaccination for mpox with you and offer advice based on an individual risk assessment. If you have been in close contact or had sex with someone with mpox or were potentially exposed to mpox through contaminated objects such as bedding or needles, follow the health advice issued by national or local health authorities. If you develop symptoms, refrain from travelling, isolate yourself, and seek medical care immediately. Should you develop symptoms after your trip, seek medical care and inform healthcare providers of your travel history and other information that may facilitate medical assessment.
Be aware that the country you’re visiting, as well as your own, may have specific entry requirements; inform yourself about them.
Your healthcare provider will be able to discuss vaccination for mpox with you and offer advice based on an individual risk assessment.
If you have been in close contact or had sex with someone with mpox or were potentially exposed to mpox through contaminated objects such as bedding or needles, follow the health advice issued by national or local health authorities. If you develop symptoms, refrain from travelling, isolate yourself, and seek medical care immediately. Should you develop symptoms after your trip, seek medical care and inform healthcare providers of your travel history and other information that may facilitate medical assessment.",https://www.who.int/news-room/questions-and-answers/item/mpox
Mpox,What do we know about mpox and sex?,"Mpox can spread through close contact of any kind, including through kissing, touching, oral and penetrative vaginal or anal sex with someone who is infectious. People who have sex with multiple or new partners are most at risk. Anyone with new and unusual rashes or lesions should avoid having sex or any other kind of close contact with other people until they have been tested for sexually transmitted infections (STIs) and mpox. Remember that the rash can also be found in places that can be hard to see inside the body, including the mouth, throat, genitals, vagina and anus/anal area. If mpox is spreading through sex in your community or area, consider reducing your risk until the outbreak is brought under control by: openly communicating with partners about mpox symptoms and risks; exchanging contact details with sexual partners so that you can inform each other if you do develop symptoms; taking a break from having sex; reducing your number of new sexual partners, one off sexual partners, or anonymous sexual partners; consistently using condoms; avoiding group sex; avoiding sex-on-premises venues (such as cruising bars, saunas, darkrooms, commercial sex venues or any premises where sex is exchanged for money); avoiding using alcohol or drugs in sexual contexts (including chemsex); and, where and when available, by taking up the offer of vaccines. While the monkeypox virus has been found in semen, it is currently not known whether mpox can be spread through semen or vaginal fluids. Wearing a condom won’t fully protect you from mpox, but it may reduce your risk or extent of exposure and it will help protect you and others from HIV and a range of other STIs. People with mpox are advised to use condoms for 12 weeks after they recover. For more information on the risk of mpox and sex, please see the public health advice for gay, bisexual and other men who have sex with men , public health advice for sex workers on mpox , and public health advice on mpox and sex-on-premises venues and events .
Mpox can spread through close contact of any kind, including through kissing, touching, oral and penetrative vaginal or anal sex with someone who is infectious. People who have sex with multiple or new partners are most at risk.
Anyone with new and unusual rashes or lesions should avoid having sex or any other kind of close contact with other people until they have been tested for sexually transmitted infections (STIs) and mpox. Remember that the rash can also be found in places that can be hard to see inside the body, including the mouth, throat, genitals, vagina and anus/anal area.
If mpox is spreading through sex in your community or area, consider reducing your risk until the outbreak is brought under control by:
While the monkeypox virus has been found in semen, it is currently not known whether mpox can be spread through semen or vaginal fluids. Wearing a condom won’t fully protect you from mpox, but it may reduce your risk or extent of exposure and it will help protect you and others from HIV and a range of other STIs. People with mpox are advised to use condoms for 12 weeks after they recover.
For more information on the risk of mpox and sex, please see the public health advice for gay, bisexual and other men who have sex with men , public health advice for sex workers on mpox , and public health advice on mpox and sex-on-premises venues and events .",https://www.who.int/news-room/questions-and-answers/item/mpox
Mpox,I have mpox. What can I do to protect other people from getting infected?,"If you have mpox, your healthcare provider will advise you on what to do while you recover. Follow national advice on whether you should recover at home or if you need care in a health facility. In the meantime, it is important to avoid having close contact with others until your lesions have completely healed. If you are advised to isolate at home, protect those you live with as much as possible by: asking friends and family to help you by delivering things you need; isolating in a separate room; using a separate bathroom, or cleaning any surfaces you touched after each use; cleaning and disinfecting frequently touched surfaces with soap and water and a household disinfectant; avoiding sweeping/vacuuming (this might disturb virus particles and cause others to become infected); using separate utensils, objects, electronics, or clean well with soap and water/disinfectant before sharing; not sharing towels, bedding or clothes; doing your own laundry (lift bedding, clothes and towels carefully without shaking them, put materials in a plastic bag before carrying it to the washing machine and wash them with hot water over 60 degrees Celsius); opening windows for good ventilation; and encouraging everyone in the house to clean their hands regularly with soap and water or an alcohol-based hand sanitizer. If you cannot avoid being in the same room as someone else or having close contact with another person while isolating at home, then do your best to limit their risk by: avoiding touching each other; cleaning your hands often with soap and water or an alcohol-based hand sanitizer; covering your rash with clothing or bandages (until you can isolate again – your rash will heal best if uncovered); opening windows throughout the home; ensuring you and anyone in the room with you wear well-fitting medical masks; and maintaining at least 1 metre of distance from others. If you cannot do your own laundry and someone else needs to do it for you, they should wear a well-fitting medical mask, disposable gloves and take the laundry precautions listed above.
If you have mpox, your healthcare provider will advise you on what to do while you recover. Follow national advice on whether you should recover at home or if you need care in a health facility.
In the meantime, it is important to avoid having close contact with others until your lesions have completely healed.
If you are advised to isolate at home, protect those you live with as much as possible by:
If you cannot avoid being in the same room as someone else or having close contact with another person while isolating at home, then do your best to limit their risk by:
If you cannot do your own laundry and someone else needs to do it for you, they should wear a well-fitting medical mask, disposable gloves and take the laundry precautions listed above.",https://www.who.int/news-room/questions-and-answers/item/mpox
Mpox,What care does someone with mpox need to recover fully?,"The care someone needs will depend on their symptoms and their risk of developing more severe disease. People with mpox should follow the advice of their health care provider. Symptoms typically last 2–4 weeks and usually go away on their own or with supportive care, such as medication for pain or fever (such as analgesics and antipyretics). It is important for anyone with mpox who is recovering at home to stay hydrated, eat well and get enough sleep. People who are self-isolating should take care of their mental health by doing things they find relaxing and enjoyable, staying connected to loved ones using technology, exercising if they feel well enough and can do so while isolating, and asking for support with their mental health if they need it. People with mpox should avoid scratching their skin and take care of their rash by cleaning their hands before and after touching lesions and keeping skin dry and uncovered (unless they are unavoidably in a room with someone else, in which case they should cover it with clothing or a bandage until they are able to isolate again). The rash can be kept clean with sterilized water or antiseptic. Saltwater rinses can be used for sores in the mouth, and warm baths with baking soda and Epsom salts can ease the discomfort of sores on the body. Paracetamol can be used to help manage the pain caused by lesions, if needed. If stronger pain medicine is needed, advice should be sought from a health care provider. See this infographic on recovering from mpox at home for some helpful tips.
The care someone needs will depend on their symptoms and their risk of developing more severe disease. People with mpox should follow the advice of their health care provider. Symptoms typically last 2–4 weeks and usually go away on their own or with supportive care, such as medication for pain or fever (such as analgesics and antipyretics).
It is important for anyone with mpox who is recovering at home to stay hydrated, eat well and get enough sleep. People who are self-isolating should take care of their mental health by doing things they find relaxing and enjoyable, staying connected to loved ones using technology, exercising if they feel well enough and can do so while isolating, and asking for support with their mental health if they need it.
People with mpox should avoid scratching their skin and take care of their rash by cleaning their hands before and after touching lesions and keeping skin dry and uncovered (unless they are unavoidably in a room with someone else, in which case they should cover it with clothing or a bandage until they are able to isolate again). The rash can be kept clean with sterilized water or antiseptic. Saltwater rinses can be used for sores in the mouth, and warm baths with baking soda and Epsom salts can ease the discomfort of sores on the body. Paracetamol can be used to help manage the pain caused by lesions, if needed. If stronger pain medicine is needed, advice should be sought from a health care provider.
See this infographic on recovering from mpox at home for some helpful tips.",https://www.who.int/news-room/questions-and-answers/item/mpox
Mpox,Why does stigma related to mpox matter?,"When there is stigma or discrimination related to a medical condition, people may not seek care quickly, the quality of health care may suffer, and access to health services for the most vulnerable is reduced. It is possible to prevent or reduce stigma and discrimination related to mpox through strategies to offer stigma-free care, employ non-stigmatizing language, support people in seeking health care and create an enabling environment where the best quality of care is available. Read more here on how to address stigma and discrimination related to mpox.
When there is stigma or discrimination related to a medical condition, people may not seek care quickly, the quality of health care may suffer, and access to health services for the most vulnerable is reduced.
It is possible to prevent or reduce stigma and discrimination related to mpox through strategies to offer stigma-free care, employ non-stigmatizing language, support people in seeking health care and create an enabling environment where the best quality of care is available.
Read more here on how to address stigma and discrimination related to mpox.",https://www.who.int/news-room/questions-and-answers/item/mpox
Mpox,What should I do if a child in my care has mpox?,"Children can catch mpox if they have close contact with someone who has symptoms. Children can be exposed to the virus at home from siblings, parents, caregivers, or other family members through close contact. In some settings in Africa, children and adolescents may be exposed through hunting or trapping activities or consumption of insufficiently cooked meat. Adolescents who have engaged in sexual activity with someone with mpox can also be exposed. The mpox rash can at first resemble other common childhood illnesses, such as chickenpox and other viral infections. If a child you are caring for has symptoms that could be mpox, seek advice from a healthcare provider. They will help to get them tested, and to access the care they need. Children may be at greater risk of severe mpox than adults. They should be closely monitored until they have recovered in case they need additional care. A health worker responsible for the child may advise that they are cared for in a health facility. In this situation, a parent or caregiver who is healthy and at low risk of mpox will be allowed to stay with them. If you have confirmed or suspected mpox and you are breastfeeding, talk to your healthcare provider for advice. They will assess the risk of transmitting mpox as well as the risk of withholding breastfeeding from your infant. If it is possible for you to continue to breastfeed and have close contact, they will advise you on how to reduce the risk by taking other measures, including covering up lesions. The risk of infection will need to be carefully balanced with the potential harm and distress caused by interrupting breastfeeding and close contact between parent and child. It is not yet known whether the monkeypox virus can be spread from parent to child through breastmilk; this is an area in need of further study.
Children can catch mpox if they have close contact with someone who has symptoms. Children can be exposed to the virus at home from siblings, parents, caregivers, or other family members through close contact. In some settings in Africa, children and adolescents may be exposed through hunting or trapping activities or consumption of insufficiently cooked meat. Adolescents who have engaged in sexual activity with someone with mpox can also be exposed. The mpox rash can at first resemble other common childhood illnesses, such as chickenpox and other viral infections. If a child you are caring for has symptoms that could be mpox, seek advice from a healthcare provider. They will help to get them tested, and to access the care they need.
Children may be at greater risk of severe mpox than adults. They should be closely monitored until they have recovered in case they need additional care. A health worker responsible for the child may advise that they are cared for in a health facility. In this situation, a parent or caregiver who is healthy and at low risk of mpox will be allowed to stay with them.
If you have confirmed or suspected mpox and you are breastfeeding, talk to your healthcare provider for advice. They will assess the risk of transmitting mpox as well as the risk of withholding breastfeeding from your infant. If it is possible for you to continue to breastfeed and have close contact, they will advise you on how to reduce the risk by taking other measures, including covering up lesions. The risk of infection will need to be carefully balanced with the potential harm and distress caused by interrupting breastfeeding and close contact between parent and child. It is not yet known whether the monkeypox virus can be spread from parent to child through breastmilk; this is an area in need of further study.",https://www.who.int/news-room/questions-and-answers/item/mpox
Mpox,Is there a treatment for mpox?,"Many years of research on therapeutics for smallpox have led to the development of products that may also be useful for treating mpox. For example, an antiviral developed to treat smallpox (tecovirimat) was approved in January 2022 by the European Medicines Agency for the treatment of mpox under exceptional circumstances. Experience with these therapeutics in the context of an outbreak of mpox is growing but still limited. For this reason, their use is usually accompanied by enrolment in a clinical trial or expanded access protocol accompanied by the collection of information that will improve knowledge on how best to use them in future.
Many years of research on therapeutics for smallpox have led to the development of products that may also be useful for treating mpox. For example, an antiviral developed to treat smallpox (tecovirimat) was approved in January 2022 by the European Medicines Agency for the treatment of mpox under exceptional circumstances. Experience with these therapeutics in the context of an outbreak of mpox is growing but still limited. For this reason, their use is usually accompanied by enrolment in a clinical trial or expanded access protocol accompanied by the collection of information that will improve knowledge on how best to use them in future.",https://www.who.int/news-room/questions-and-answers/item/mpox
Mpox,Are people who are immunosuppressed at higher risk of developing severe mpox (including people living with HIV)?,"Persons with immune suppression are at higher risk of developing severe mpox or dying. Severe mpox can include larger, more widespread lesions (especially in the mouth, eyes and genitals), conditions such as inflammation of the heart, brain or other organs, or secondary bacterial infections of the skin or blood and lung infections. People with advanced HIV disease (late presentation, low CD4 count and high HIV viral load) have an elevated risk of death if they develop severe mpox. This is more common in people with HIV status unknown prior to a diagnosis of mpox. People living with HIV who achieve viral suppression through antiretroviral treatment do not appear to be at any higher risk of severe mpox than the general population. Use of daily effective HIV treatment (antiretrovirals or ARVs) reduces the risk of developing severe mpox symptoms in the case of infection. People with untreated HIV and advanced HIV disease may be immunocompromised and therefore be at greater risk of severe mpox. WHO advises countries to integrate HIV and mpox testing, prevention and care. People who are sexually active and who do not know their HIV status are advised to seek a test for HIV. People living with HIV on effective treatment have the same life expectancy as their HIV negative peers. Severe mpox cases seen in some countries highlight the urgent need to increase equitable access to mpox diagnostic tests, vaccines and therapeutics, and to HIV prevention, testing and treatment. Without this, most affected groups are being left without the tools they need to protect their sexual health and well-being. If you are living with HIV, continue to take your HIV medication as directed. If you think you may have mpox, seek medical advice. If you think you are at risk for mpox or have been diagnosed with mpox, you may benefit from testing for sexually transmitted infections (STIs). If you don’t know your HIV status, ask your health worker for an HIV test. This will help your health care provider to ensure you receive the best possible care. In 2023 there were 9 million people in the world living with HIV but not on HIV treatment and who could be at risk for advanced HIV disease – 5 million of whom were living in Africa.
Persons with immune suppression are at higher risk of developing severe mpox or dying. Severe mpox can include larger, more widespread lesions (especially in the mouth, eyes and genitals), conditions such as inflammation of the heart, brain or other organs, or secondary bacterial infections of the skin or blood and lung infections.
People with advanced HIV disease (late presentation, low CD4 count and high HIV viral load) have an elevated risk of death if they develop severe mpox. This is more common in people with HIV status unknown prior to a diagnosis of mpox.
People living with HIV who achieve viral suppression through antiretroviral treatment do not appear to be at any higher risk of severe mpox than the general population. Use of daily effective HIV treatment (antiretrovirals or ARVs) reduces the risk of developing severe mpox symptoms in the case of infection. People with untreated HIV and advanced HIV disease may be immunocompromised and therefore be at greater risk of severe mpox. WHO advises countries to integrate HIV and mpox testing, prevention and care.
People who are sexually active and who do not know their HIV status are advised to seek a test for HIV. People living with HIV on effective treatment have the same life expectancy as their HIV negative peers.
Severe mpox cases seen in some countries highlight the urgent need to increase equitable access to mpox diagnostic tests, vaccines and therapeutics, and to HIV prevention, testing and treatment. Without this, most affected groups are being left without the tools they need to protect their sexual health and well-being.
If you are living with HIV, continue to take your HIV medication as directed. If you think you may have mpox, seek medical advice.
If you think you are at risk for mpox or have been diagnosed with mpox, you may benefit from testing for sexually transmitted infections (STIs). If you don’t know your HIV status, ask your health worker for an HIV test. This will help your health care provider to ensure you receive the best possible care. In 2023 there were 9 million people in the world living with HIV but not on HIV treatment and who could be at risk for advanced HIV disease – 5 million of whom were living in Africa.",https://www.who.int/news-room/questions-and-answers/item/mpox
